{
  "schema": "mimesis.release-review-bundle.v0.1",
  "status": "local_release_review_bundle_not_commit",
  "generatedAt": "2026-06-11T06:22:18.317Z",
  "completionAllowed": false,
  "package": {
    "name": "mimesis-engineering",
    "version": "0.1.0",
    "private": true,
    "license": "UNLICENSED"
  },
  "git": {
    "branch": "codex/mimesis-framework-v0.1",
    "upstream": "origin/codex/mimesis-framework-v0.1",
    "head": "deb6612fde19e7161b3191a3eb9cdffe427e4b8d",
    "dirty": true,
    "trackedChangedCount": 26,
    "untrackedCount": 0
  },
  "sourceFiles": [
    ".mimesis/worktree/review-packet.json",
    ".mimesis/state/current-state.json",
    ".mimesis/gaps/current-gap-register.json",
    ".mimesis/release-evidence/v0.1-report.md"
  ],
  "trackedChangedPaths": [
    ".mimesis/completion/goal-completion-audit.json",
    ".mimesis/framework-manifest.json",
    ".mimesis/gaps/closure-plan.json",
    ".mimesis/gaps/current-gap-register.json",
    ".mimesis/gates/closure-readiness.json",
    ".mimesis/gates/closure-review.json",
    ".mimesis/publish-packets/local-sync-handoff.md",
    ".mimesis/release-artifacts/v0.1-manifest.json",
    ".mimesis/release-decisions/owner-decision-record.json",
    ".mimesis/release-review/v0.1-bundle.json",
    ".mimesis/run_ledger.md",
    ".mimesis/state/current-state.json",
    ".mimesis/sync-status.md",
    ".mimesis/worktree/review-packet.json",
    "README.md",
    "ROADMAP.md",
    "STATUS.md",
    "docs/COMPLETION-AUDIT.md",
    "docs/FRAMEWORK-MANIFEST.md",
    "docs/GATE-CLOSURE-READINESS.md",
    "docs/RELEASE-CHECK-ORDER.md",
    "spec/gate-closure-readiness.schema.json",
    "tools/README.md",
    "tools/audit-gate-closure-readiness.mjs",
    "tools/create-framework-manifest.mjs",
    "tools/create-gate-closure-readiness.mjs"
  ],
  "reviewGroups": [
    {
      "name": "tracked core edits",
      "count": 1,
      "sample": [
        "README.md"
      ],
      "note": "Tracked root-framework files that need human review."
    },
    {
      "name": "generated protocol artifacts",
      "count": 14,
      "sample": [
        ".mimesis/completion/goal-completion-audit.json",
        ".mimesis/framework-manifest.json",
        ".mimesis/gaps/closure-plan.json",
        ".mimesis/gaps/current-gap-register.json",
        ".mimesis/gates/closure-readiness.json",
        ".mimesis/gates/closure-review.json",
        ".mimesis/publish-packets/local-sync-handoff.md",
        ".mimesis/release-artifacts/v0.1-manifest.json",
        ".mimesis/release-decisions/owner-decision-record.json",
        ".mimesis/release-review/v0.1-bundle.json",
        ".mimesis/run_ledger.md",
        ".mimesis/state/current-state.json",
        ".mimesis/sync-status.md",
        ".mimesis/worktree/review-packet.json"
      ],
      "note": "Generated .mimesis packets and reports."
    },
    {
      "name": "public documentation",
      "count": 7,
      "sample": [
        "docs/COMPLETION-AUDIT.md",
        "docs/FRAMEWORK-MANIFEST.md",
        "docs/GATE-CLOSURE-READINESS.md",
        "docs/RELEASE-CHECK-ORDER.md",
        "README.md",
        "ROADMAP.md",
        "STATUS.md"
      ],
      "note": "Public-facing docs, examples, cases, and status pages."
    },
    {
      "name": "tooling and cli",
      "count": 4,
      "sample": [
        "tools/audit-gate-closure-readiness.mjs",
        "tools/create-framework-manifest.mjs",
        "tools/create-gate-closure-readiness.mjs",
        "tools/README.md"
      ],
      "note": "Scripts, CLI, actions, adapters, and plugin scaffolds."
    },
    {
      "name": "spec and schemas",
      "count": 1,
      "sample": [
        "spec/gate-closure-readiness.schema.json"
      ],
      "note": "Spec contracts, templates, and reference packs."
    }
  ],
  "requiredReviewSequence": [
    "Read .mimesis/worktree/review-packet.json for dirty worktree scope.",
    "Review public documentation claims before staging anything.",
    "Run npm run audit:secrets and inspect .mimesis/security/secret-safety-report.md.",
    "Run npm run release:check and keep all proof boundaries green.",
    "Owner decides whether to stage, commit, push, tag, release, publish, or keep changes local.",
    "Run npm run audit:sync:strict only after the intended worktree is clean and synced."
  ],
  "openGateSummary": {
    "status": "open_gates_remain",
    "gapCount": 9,
    "topNextActions": [
      {
        "id": "strict_publish_sync",
        "nextAction": "Run the runtime-only non-writing strict sync gate after the intended branch is pushed.",
        "boundary": "Committed gap-register snapshots do not close strict sync; only the runtime-only non-writing strict sync audit proves current local upstream sync."
      },
      {
        "id": "owner_license_decision",
        "nextAction": "Owner chooses a reuse license or keeps the no-reuse boundary.",
        "boundary": "Does not choose a license or provide legal advice."
      },
      {
        "id": "permissioned_external_artifact",
        "nextAction": "Collect one user-submitted, permissioned, or clearly redacted weak artifact.",
        "boundary": "Does not create external proof or grant permission."
      }
    ]
  },
  "releaseEvidenceBoundary": "release evidence report keeps publication boundary visible",
  "boundaries": [
    "does_not_stage_commit_push_tag_release",
    "does_not_publish",
    "does_not_choose_license",
    "does_not_prove_remote_freshness",
    "does_not_close_strict_sync",
    "does_not_create_external_proof",
    "does_not_prove_adoption"
  ],
  "allowedClaim": "Mimesis has a local release review bundle that classifies dirty worktree review scope; it is not commit, push, tag, release, or publication.",
  "disallowedClaim": "The release review bundle does not close strict sync, prove remote freshness, stage files, commit, push, tag, release, publish, choose a license, create external proof, or prove adoption."
}
